{
  "schemaVersion": "1.0",
  "screenId": "refund-confirmation",
  "title": "确认退款",
  "components": [
    {
      "id": "order",
      "type": "Card",
      "props": {
        "title": "订单 10001",
        "items": [
          {
            "label": "商品",
            "value": "示例商品"
          },
          {
            "label": "金额",
            "value": "128.00 CNY"
          },
          {
            "label": "状态",
            "value": "PAID"
          }
        ]
      }
    },
    {
      "id": "refund-summary",
      "type": "Card",
      "props": {
        "title": "退款信息",
        "items": [
          {
            "label": "退款金额",
            "value": "128.00"
          },
          {
            "label": "币种",
            "value": "CNY"
          },
          {
            "label": "退款资格",
            "value": "满足",
            "tone": "success"
          },
          {
            "label": "预计到账",
            "value": "3 天"
          }
        ]
      }
    },
    {
      "id": "refund-form",
      "type": "Form",
      "props": {
        "fields": [
          {
            "name": "reason",
            "type": "select",
            "label": "退款原因",
            "required": true,
            "options": [
              {
                "label": "商品破损",
                "value": "DAMAGED"
              },
              {
                "label": "未收到货",
                "value": "NOT_RECEIVED"
              },
              {
                "label": "买错了",
                "value": "CHANGED_MIND"
              }
            ]
          }
        ]
      }
    }
  ],
  "actions": [
    {
      "id": "confirm-refund",
      "type": "submit",
      "label": "确认退款",
      "style": "danger",
      "confirmationToken": "ct_ExAmPlE0123456789abcdef"
    },
    {
      "id": "cancel",
      "type": "cancel",
      "label": "取消",
      "style": "default"
    }
  ]
}
