{
  "schemaVersion": "1.0",
  "screenId": "delete-confirmation",
  "title": "确认删除订单",
  "components": [
    {
      "id": "order",
      "type": "Card",
      "props": {
        "title": "订单 10005",
        "items": [
          {
            "label": "商品",
            "value": "运动鞋"
          },
          {
            "label": "件数",
            "value": "1"
          },
          {
            "label": "金额",
            "value": "459.00 CNY"
          },
          {
            "label": "状态",
            "value": "COMPLETED"
          },
          {
            "label": "提示",
            "value": "删除后订单将从列表消失，不可恢复",
            "tone": "danger"
          }
        ]
      }
    }
  ],
  "actions": [
    {
      "id": "confirm-delete",
      "type": "submit",
      "label": "确认删除",
      "style": "danger",
      "confirmationToken": "ct_ExAmPlE0123456789abcdef"
    },
    {
      "id": "cancel",
      "type": "cancel",
      "label": "取消",
      "style": "default"
    }
  ]
}
