{
  "schemaVersion": "1.0",
  "screenId": "aftersale-confirmation",
  "title": "申请售后",
  "components": [
    {
      "id": "order",
      "type": "Card",
      "props": {
        "title": "订单 10002",
        "items": [
          {
            "label": "商品",
            "value": "蓝牙耳机"
          },
          {
            "label": "件数",
            "value": "1"
          },
          {
            "label": "金额",
            "value": "299.00 CNY"
          },
          {
            "label": "状态",
            "value": "SHIPPED"
          }
        ]
      }
    },
    {
      "id": "aftersale-form",
      "type": "Form",
      "props": {
        "fields": [
          {
            "name": "type",
            "type": "select",
            "label": "售后类型",
            "required": true,
            "options": [
              {
                "label": "退货",
                "value": "RETURN"
              },
              {
                "label": "换货",
                "value": "EXCHANGE"
              },
              {
                "label": "维修",
                "value": "REPAIR"
              }
            ]
          },
          {
            "name": "reason",
            "type": "text",
            "label": "问题描述",
            "required": true
          }
        ]
      }
    }
  ],
  "actions": [
    {
      "id": "confirm-aftersale",
      "type": "submit",
      "label": "提交售后申请",
      "style": "primary",
      "confirmationToken": "ct_ExAmPlE0123456789abcdef"
    },
    {
      "id": "cancel",
      "type": "cancel",
      "label": "取消",
      "style": "default"
    }
  ]
}
