{
  "schemaVersion": "1.0",
  "screenId": "product-list",
  "title": "商品列表",
  "components": [
    {
      "id": "products",
      "type": "Table",
      "props": {
        "columns": [
          {
            "key": "productId",
            "title": "编号"
          },
          {
            "key": "title",
            "title": "商品"
          },
          {
            "key": "price",
            "title": "价格"
          },
          {
            "key": "stock",
            "title": "库存"
          },
          {
            "key": "category",
            "title": "分类"
          }
        ],
        "rows": [
          {
            "id": "P-1003",
            "cells": {
              "productId": "P-1003",
              "title": "无线耳机 Pro",
              "price": "899.00 CNY",
              "stock": "120",
              "category": "数码"
            },
            "actions": [
              {
                "label": "查看商品",
                "intent": "查看商品 P-1003 的详情"
              }
            ]
          },
          {
            "id": "P-1011",
            "cells": {
              "productId": "P-1011",
              "title": "智能台灯",
              "price": "199.00 CNY",
              "stock": "0",
              "category": "家居"
            },
            "actions": [
              {
                "label": "查看商品",
                "intent": "查看商品 P-1011 的详情"
              }
            ]
          }
        ],
        "total": 20,
        "emptyText": "共 20 件，仅展示 2 件"
      }
    }
  ],
  "actions": []
}
