{
  "schemaVersion": "1.0",
  "screenId": "refund-result",
  "title": "退款已提交",
  "components": [
    {
      "id": "result",
      "type": "ResultCard",
      "props": {
        "status": "success",
        "title": "退款已提交",
        "description": "退款 128.00 元将在 1-3 个工作日内原路退回。",
        "details": [
          { "label": "订单号", "value": "10001" },
          { "label": "退款单号", "value": "rf_000001" },
          { "label": "退款金额", "value": "128.00" }
        ]
      }
    }
  ],
  "actions": []
}
